{
  "$schema": "https://json-schema.org/draft/2020-12/schema",
  "$id": "https://kdesktop/assistant/assistant.schema.json",
  "title": "Manifest of an assistant (assistant.json)",
  "type": "object",
  "required": ["id", "name", "version", "author", "sdk", "entry", "traits"],
  "additionalProperties": false,
  "properties": {
    "$schema": { "type": "string" },
    "id": { "$ref": "common.schema.json#/$defs/id" },
    "name": { "type": "string", "minLength": 1, "maxLength": 40 },
    "version": {
      "description": "Semantic version. Installing one with the same id and a higher version updates it.",
      "type": "string",
      "pattern": "^\\d+\\.\\d+\\.\\d+(-[0-9A-Za-z.-]+)?$"
    },
    "author": { "type": "string", "minLength": 1, "maxLength": 80 },
    "description": { "$ref": "common.schema.json#/$defs/text" },
    "homepage": { "type": "string", "format": "uri" },
    "license": { "type": "string" },
    "sdk": {
      "description": "Version of the SDK it was built against («1.21»). Same major number as K-Desktop's and a minor one no higher = compatible.",
      "type": "string",
      "pattern": "^\\d+\\.\\d+$"
    },
    "entry": {
      "description": "Assembly and type that implements IAssistant: «lib/File.dll!Name.Space.Type». Or, for an assistant without code, its character.json (character.schema.json): the host moves it with its pictures.",
      "type": "string",
      "pattern": "^(lib/[A-Za-z0-9_.-]+\\.dll![A-Za-z_][A-Za-z0-9_.]*|[A-Za-z0-9_-]+\\.json)$"
    },
    "icon": { "$ref": "common.schema.json#/$defs/packagePath" },
    "preview": { "$ref": "common.schema.json#/$defs/packagePath" },
    "wakeWord": {
      "description": "Suggested name to call it by. On install, K-Desktop offers to record it with the user's voice.",
      "type": "string",
      "minLength": 2,
      "maxLength": 30
    },
    "model": {
      "description": "Suggested AI model: one or several of Hugging Face («owner/repo/file.gguf» or «owner/repo:Q4_K_M»), the best first. K-Desktop offers the first one that fits in the graphics card; it never downloads it without asking.",
      "type": "object",
      "additionalProperties": false,
      "properties": {
        "suggested": {
          "oneOf": [
            { "$ref": "#/$defs/hfModel" },
            { "type": "array", "minItems": 1, "items": { "$ref": "#/$defs/hfModel" } }
          ]
        },
        "min": { "type": "string", "pattern": "^\\d+(\\.\\d+)?[bB]$" },
        "think": {
          "description": "Suggested model to think harder with («think it over», or when it asks for it itself): like «suggested». K-Desktop offers it apart, unticked; without one, it thinks harder with its usual model.",
          "oneOf": [
            { "$ref": "#/$defs/hfModel" },
            { "type": "array", "minItems": 1, "items": { "$ref": "#/$defs/hfModel" } }
          ]
        }
      }
    },
    "voice": { "description": "Its default voice profile.", "$ref": "common.schema.json#/$defs/packagePath" },
    "persona": {
      "description": "Personality and lines. It can carry «{lang}» (persona/{lang}.json); if the user's language is not there, English or the first one there is.",
      "$ref": "common.schema.json#/$defs/packagePath"
    },
    "settings": { "description": "Its settings (settings.json by default).", "$ref": "common.schema.json#/$defs/packagePath" },
    "panel": { "description": "Its panel (panel.json by default).", "$ref": "common.schema.json#/$defs/packagePath" },
    "traits": {
      "type": "object",
      "required": ["travel", "gestures"],
      "additionalProperties": false,
      "properties": {
        "travel": { "enum": ["fly", "walk", "teleport"] },
        "travelSpeed": { "type": "number", "exclusiveMinimum": 0, "default": 600 },
        "canMoveWindows": { "type": "boolean", "default": false },
        "canReachMaximized": { "type": "boolean", "default": false },
        "gestures": {
          "description": "Gestures it can perform (communicate and react are always taken as known).",
          "type": "array",
          "uniqueItems": true,
          "items": {
            "enum": ["pointAt", "goTo", "pressButton", "moveWindow", "activateWindow", "waitForWindow", "mark", "scan", "typing", "communicate", "react", "announce"]
          }
        }
      }
    },
    "common": {
      "description": "Common settings it takes: K-Desktop shows them in the «General» tab of its card and passes them in IAssistantHost.Common (the volume is applied by the host). One without code takes them all.",
      "type": "array",
      "uniqueItems": true,
      "items": { "enum": ["size", "volume", "liveliness", "dragging"] }
    },
    "speech": {
      "description": "Who draws what it says: «host» (the default), K-Desktop's bubble; «own», the assistant itself with IAssistant.ShowSpeech (when it cannot, or when the user asks for it on its card, K-Desktop's bubble shows). One without code always uses K-Desktop's.",
      "enum": ["host", "own"]
    },
    "extras": {
      "description": "Its own actions, which show as «Assistant: action» in K-Desktop's commands, in its right-click menu and in its panel.",
      "type": "array",
      "items": {
        "type": "object",
        "required": ["id", "name"],
        "additionalProperties": false,
        "properties": {
          "id": { "$ref": "common.schema.json#/$defs/id" },
          "name": { "$ref": "common.schema.json#/$defs/text" },
          "description": { "$ref": "common.schema.json#/$defs/text" },
          "icon": { "$ref": "common.schema.json#/$defs/icon" },
          "hotkey": { "description": "Shortcut K-Desktop offers to create on install.", "$ref": "common.schema.json#/$defs/hotkey" }
        }
      }
    },
    "updates": {
      "description": "URL of the latest package (.kai) to check for updates (https; http only to localhost or 127.0.0.1, for testing).",
      "type": "string",
      "format": "uri",
      "pattern": "^(https://|http://(localhost|127\\.0\\.0\\.1)[:/])"
    },
    "changes": {
      "description": "What this version brings: K-Desktop shows it when offering it as an update and on its card.",
      "$ref": "common.schema.json#/$defs/text"
    },
    "showcase": {
      "description": "Short clips of its showcase, for the catalog: K-Desktop shows them without loading its code. «item» is the id of what it shows: one of K-Desktop's (enter.summoned, state.thinking, react.success, gesture.announce, window.move — the window ones need sdk 1.21 —…) or one of its own from IAssistant.Showcase, which needs «name». Recorded by the SDK's .targets with AssistantShowcase=true.",
      "type": "array",
      "items": {
        "type": "object",
        "required": ["item", "clip"],
        "additionalProperties": false,
        "properties": {
          "item": { "type": "string", "minLength": 1, "maxLength": 64 },
          "clip": { "description": "An animated WebP, a GIF or a PNG of the package (8 MB at most).", "$ref": "common.schema.json#/$defs/packagePath" },
          "name": { "description": "Its name, only for its own ones.", "$ref": "common.schema.json#/$defs/text" },
          "group": { "enum": ["idle", "moving", "playing", "feelings", "tricks", "other"] }
        }
      }
    },
    "importFrom": {
      "description": "Data of a standalone version K-Desktop can offer to import (paths with environment variables).",
      "type": "array",
      "items": { "type": "string", "minLength": 1 }
    }
  },
  "$defs": {
    "hfModel": {
      "description": "A model of Hugging Face: «owner/repo/file.gguf» or «owner/repo:QUANTIZATION».",
      "type": "string",
      "pattern": "^[A-Za-z0-9_.-]+/[A-Za-z0-9_.-]+(:[A-Za-z0-9_.-]+|/.+\\.gguf)?$"
    }
  }
}
