{
  "id": "myassistant-id",
  "name": "MyAssistant",
  "version": "1.0.0",
  "author": "AUTHOR_NAME",
  "description": "A new assistant for K-Desktop.",
  "sdk": "1.15",
  "entry": "lib/MyAssistant.dll!MyAssistant.MyAssistant",
  "icon": "icon.png",
  "wakeWord": "MyAssistant",
  "common": ["size"],
  "traits": {
    "travel": "teleport",
    "canMoveWindows": false,
    "gestures": ["communicate", "react", "announce"]
  }
}
