{
  "$schema": "../../../docs/assistant/schemas/assistant.schema.json",
  "id": "pip",
  "name": "Pip",
  "version": "1.5.0",
  "author": "Kobayashi82",
  "description": {
    "es": "Ejemplo de asistente sin código: una gota que pasea por la barra de tareas y por tus ventanas. Solo imágenes y JSON.",
    "en": "Example assistant without code: a drop that strolls along the taskbar and your windows. Only images and JSON.",
    "fr": "Exemple d’assistant sans code : une goutte qui se promène sur la barre des tâches et vos fenêtres. Seulement des images et du JSON.",
    "de": "Beispielassistent ohne Code: ein Tropfen, der über die Taskleiste und deine Fenster spaziert. Nur Bilder und JSON.",
    "it": "Esempio di assistente senza codice: una goccia che passeggia sulla barra delle applicazioni e sulle tue finestre. Solo immagini e JSON.",
    "pt": "Exemplo de assistente sem código: uma gota que passeia pela barra de tarefas e pelas suas janelas. Só imagens e JSON."
  },
  "homepage": "https://github.com/Kobayashi82/K-Desktop",
  "license": "MIT",
  "sdk": "1.21",
  "entry": "character.json",
  "icon": "icon.png",
  "wakeWord": "Pip",
  "traits": {
    "travel": "walk",
    "travelSpeed": 70,
    "canMoveWindows": false,
    "canReachMaximized": false,
    "gestures": ["communicate", "react", "announce"]
  },
  "changes": {
    "es": "Ahora enseña en el catálogo lo que sabe hacer: clips de sus entradas, salidas, estados, reacciones y animaciones.",
    "en": "It now shows what it can do in the catalog: clips of its entrances, exits, states, reactions and animations.",
    "fr": "Il montre maintenant ce qu’il sait faire dans le catalogue : des clips de ses entrées, sorties, états, réactions et animations.",
    "de": "Zeigt jetzt im Katalog, was er kann: Clips seiner Auftritte, Abgänge, Zustände, Reaktionen und Animationen.",
    "it": "Ora mostra nel catalogo cosa sa fare: clip delle sue entrate, uscite, stati, reazioni e animazioni.",
    "pt": "Agora mostra no catálogo o que sabe fazer: clipes das suas entradas, saídas, estados, reações e animações."
  },
  "showcase": [
    {
      "item": "enter.startup",
      "clip": "showcase/enter.startup.webp"
    },
    {
      "item": "enter.summoned",
      "clip": "showcase/enter.summoned.webp"
    },
    {
      "item": "exit.dismissed",
      "clip": "showcase/exit.dismissed.webp"
    },
    {
      "item": "exit.uninstalling",
      "clip": "showcase/exit.uninstalling.webp"
    },
    {
      "item": "state.listening",
      "clip": "showcase/state.listening.webp"
    },
    {
      "item": "state.thinking",
      "clip": "showcase/state.thinking.webp"
    },
    {
      "item": "state.thinkingHard",
      "clip": "showcase/state.thinkingHard.webp"
    },
    {
      "item": "state.loadingBrain",
      "clip": "showcase/state.loadingBrain.webp"
    },
    {
      "item": "state.busy",
      "clip": "showcase/state.busy.webp"
    },
    {
      "item": "state.awaitingConfirmation",
      "clip": "showcase/state.awaitingConfirmation.webp"
    },
    {
      "item": "state.speaking",
      "clip": "showcase/state.speaking.webp"
    },
    {
      "item": "state.noBrain",
      "clip": "showcase/state.noBrain.webp"
    },
    {
      "item": "state.sleeping",
      "clip": "showcase/state.sleeping.webp"
    },
    {
      "item": "react.success",
      "clip": "showcase/react.success.webp"
    },
    {
      "item": "react.celebration",
      "clip": "showcase/react.celebration.webp"
    },
    {
      "item": "react.warning",
      "clip": "showcase/react.warning.webp"
    },
    {
      "item": "react.failure",
      "clip": "showcase/react.failure.webp"
    },
    {
      "item": "gesture.announce",
      "clip": "showcase/gesture.announce.webp"
    },
    {
      "item": "gesture.communicate",
      "clip": "showcase/gesture.communicate.webp"
    },
    {
      "item": "walk",
      "clip": "showcase/walk.webp",
      "name": {
        "de": "Gehen",
        "en": "Walk",
        "es": "Andar",
        "fr": "Marcher",
        "it": "Camminare",
        "pt": "Andar"
      },
      "group": "moving"
    },
    {
      "item": "sleep",
      "clip": "showcase/sleep.webp",
      "name": {
        "de": "Schlafen",
        "en": "Sleep",
        "es": "Dormir",
        "fr": "Dormir",
        "it": "Dormire",
        "pt": "Dormir"
      },
      "group": "idle"
    },
    {
      "item": "surprised",
      "clip": "showcase/surprised.webp",
      "name": {
        "de": "Überrascht",
        "en": "Surprised",
        "es": "Sorprenderse",
        "fr": "Surpris",
        "it": "Sorpreso",
        "pt": "Surpreso"
      },
      "group": "feelings"
    },
    {
      "item": "click",
      "clip": "showcase/click.webp",
      "name": {
        "de": "Beim Anklicken",
        "en": "When clicked",
        "es": "Al hacerle clic",
        "fr": "Quand on clique dessus",
        "it": "Quando lo clicchi",
        "pt": "Ao clicar nele"
      },
      "group": "playing"
    },
    {
      "item": "catch",
      "clip": "showcase/catch.webp",
      "name": {
        "de": "Etwas fangen",
        "en": "Catch something",
        "es": "Coger algo",
        "fr": "Attraper quelque chose",
        "it": "Afferrare qualcosa",
        "pt": "Pegar algo"
      },
      "group": "playing"
    }
  ]
}
